{
    "$schema": "http://json-schema.org/draft-07/schema#",
    "$id": "https://raw.githubusercontent.com/Pollux12/gmod-luals-addon/test-plugin/glua-api-snippets.schema.json",
    "title": "GLua API Snippets Workspace Configuration",
    "description": "Schema for workspace overrides (e.g. .glua-api-snippets.json). This file describes the shape of the JSON used to override values from the plugin's default config.lua.",
    "type": "object",
    "properties": {
        "scopes": {
            "type": "array",
            "description": "List of scripted class scopes (ENT, SWEP, EFFECT, TOOL, ...)",
            "items": {
                "type": "object",
                "properties": {
                    "global": {
                        "type": "string",
                        "description": "Global identifier for the scope (e.g. ENT, SWEP)"
                    },
                    "folder": {
                        "type": "string",
                        "description": "Relative folder used to match files for this scope"
                    },
                    "folderIndicators": {
                        "type": "array",
                        "items": {
                            "type": "string"
                        },
                        "description": "Exact filenames that indicate a folder-based class (e.g. init.lua)"
                    },
                    "additionalPatterns": {
                        "type": "array",
                        "items": {
                            "type": "string"
                        },
                        "description": "Lua patterns used to heuristically detect class files in a folder"
                    }
                },
                "required": [
                    "global"
                ],
                "additionalProperties": true
            }
        },
        "dtTypes": {
            "type": "object",
            "description": "Mapping of DT_* names to Lua types used by NetworkVar resolution",
            "additionalProperties": {
                "type": "string"
            }
        },
        "baseGmodMap": {
            "type": "object",
            "description": "Set of known built-in base class names (keys) considered equivalent to ENT",
            "additionalProperties": {
                "type": "boolean"
            }
        },
        "accessorForceTypes": {
            "type": "object",
            "description": "Mapping of AccessorFunc FORCE_* constants to Lua types",
            "additionalProperties": {
                "type": "string"
            }
        },
        "paramNameTypes": {
            "type": "object",
            "description": "Best-effort parameter name => type hints used by OnCompileFunctionParam",
            "additionalProperties": {
                "type": "string"
            }
        },
        "accessorForceTypesByNumber": {
            "type": "object",
            "description": "Numeric Force type map; JSON object keys are strings so numeric-string keys are allowed and will be coerced by the plugin.",
            "patternProperties": {
                "^\\d+$": {
                    "type": "string"
                }
            },
            "additionalProperties": {
                "type": "string"
            }
        },
        "patterns": {
            "type": "object",
            "description": "Custom Lua pattern overrides used by the plugin to find registrations and assignments",
            "additionalProperties": {
                "type": "string"
            }
        }
    },
    "additionalProperties": true
}