{
  "$schema": "https://raw.githubusercontent.com/Pollux12/gmod-luals-addon/test-plugin/glua-api-snippets.schema.json",
  "scopes": [
    {
      "global": "ENT",
      "folder": "entities",
      "folderIndicators": [
        "shared.lua",
        "init.lua",
        "cl_init.lua"
      ],
      "additionalPatterns": [
        "sv_.*\\.lua$",
        "cl_.*\\.lua$",
        "sh_.*\\.lua$"
      ]
    },
    {
      "global": "SWEP",
      "folder": "weapons",
      "folderIndicators": [
        "shared.lua",
        "init.lua",
        "cl_init.lua"
      ],
      "additionalPatterns": [
        "sv_.*\\.lua$",
        "cl_.*\\.lua$",
        "sh_.*\\.lua$"
      ]
    },
    {
      "global": "EFFECT",
      "folder": "effects",
      "folderIndicators": [
        "init.lua",
        "cl_init.lua"
      ],
      "additionalPatterns": [
        "cl_.*\\.lua$"
      ]
    },
    {
      "global": "TOOL",
      "folder": "weapons/gmod_tool/stools",
      "folderIndicators": [
        "shared.lua",
        "init.lua",
        "cl_init.lua"
      ],
      "additionalPatterns": [
        "sv_.*\\.lua$",
        "cl_.*\\.lua$",
        "sh_.*\\.lua$"
      ]
    }
  ],
  "dtTypes": {
    "String": "string",
    "Bool": "boolean",
    "Float": "number",
    "Int": "integer",
    "Vector": "Vector",
    "Angle": "Angle",
    "Entity": "Entity"
  },
  "baseGmodMap": {
    "base_gmodentity": true,
    "base_entity": true,
    "base_brush": true,
    "base_anim": true,
    "base_ai": true,
    "base_nextbot": true,
    "base_point": true,
    "base_filter": true
  },
  "accessorForceTypes": {
    "FORCE_STRING": "string",
    "FORCE_NUMBER": "number",
    "FORCE_BOOL": "boolean",
    "FORCE_ANGLE": "Angle",
    "FORCE_COLOR": "Color",
    "FORCE_VECTOR": "Vector"
  },
  "paramNameTypes": {
    "ply": "Player",
    "player": "Player",
    "client": "Player",
    "ent": "Entity",
    "entity": "Entity",
    "veh": "Vehicle",
    "car": "Vehicle",
    "vec": "Vector",
    "vector": "Vector",
    "ang": "Angle",
    "angle": "Angle",
    "col": "Color",
    "color": "Color",
    "pos": "Vector",
    "pos1": "Vector",
    "pos2": "Vector",
    "startpos": "Vector",
    "endpos": "Vector",
    "plypos": "Vector",
    "hitpos": "Vector",
    "owner": "Entity",
    "attacker": "Entity",
    "victim": "Entity",
    "activator": "Entity",
    "caller": "Entity",
    "inflictor": "Entity",
    "swep": "SWEP",
    "wep": "Weapon",
    "weapon": "Weapon",
    "name": "string",
    "filepath": "string",
    "filename": "string",
    "url": "string",
    "steamid": "string",
    "steamid64": "string",
    "sid64": "string",
    "str": "string",
    "tbl": "table",
    "msg": "string",
    "distance": "number",
    "speed": "number",
    "num": "number",
    "count": "number"
  },
  "accessorForceTypesByNumber": {
    "0": "any",
    "1": "string",
    "2": "number",
    "3": "boolean",
    "4": "Angle",
    "5": "Color",
    "6": "Vector"
  },
  "patterns": {
    "vguiRegister": "vgui\\s*%.\\s*Register\\s*%(",
    "dermaDefineControl": "derma\\s*%.\\s*DefineControl\\s*%(",
    "accessorFunc": "AccessorFunc\\s*%(",
    "networkVar": "NetworkVar\\s*%(",
    "networkVarElement": "NetworkVarElement\\s*%(",
    "defineBaseclass": "DEFINE_BASECLASS\\s*(%b())",
    "variableAssignment": "([%a_][%w_]*)\\s*=\\s*",
    "localGlobal": "%f[%a]local\\s+([%a_][%w_]*)\\s*=",
    "localGlobalByNameTemplate": "%f[%a]local\\s+{name}\\s*=",
    "baseAssignment": "([%a_][%w_]*)%.\\s*Base\\s*=\\s*([%a_][%w_%.]*)",
    "baseStringAssignment": "([%a_][%w_]*)%.\\s*Base\\s*=\\s*['\"']([^'\"']+)['\"']",
    "baseAssignmentByNameTemplate": "{name}%.\\s*Base\\s*=\\s*([%a_][%w_%.]*)",
    "baseStringAssignmentByNameTemplate": "{name}%.\\s*Base\\s*=\\s*['\"']([^'\"']+)['\"']"
  }
}
